{
  "schema_version": "1.0.0",
  "directory": "AI API Atlas",
  "last_updated": "2026-09-20",
  "scope": {
    "includes": [
      "API-accessible AI inference with a recurring or currently usable free allocation",
      "Account-required free APIs and free model pools",
      "Free monthly credits where the provider explicitly grants them to free accounts",
      "Anonymous/keyless free APIs when they are useful to developers"
    ],
    "excludes": [
      "Chat-only/web-only products with no developer API",
      "Expired or clearly discontinued free programs",
      "Promotions whose free allocation is already known to be over",
      "Providers where a free API claim cannot be traced to a provider or primary technical source"
    ]
  },
  "providers": [
    {
      "id": "google-gemini",
      "name": "Google Gemini API",
      "category": "first_party",
      "country": "US",
      "country_flag": "🇺🇸",
      "signup_url": "https://aistudio.google.com/app/apikey",
      "docs_url": "https://ai.google.dev/gemini-api/docs/get-started",
      "pricing_url": "https://ai.google.dev/gemini-api/docs/billing",
      "base_url": "https://generativelanguage.googleapis.com/v1beta",
      "auth": "api_key",
      "account_required": true,
      "card_required": false,
      "identity_verification": "unknown",
      "openai_compatible": true,
      "free_tier_type": "recurring_free_tier",
      "free_summary": "New Gemini API accounts start on the Free Tier with access to selected models within their model-specific free-tier limits.",
      "quota_summary": "Model-specific quotas; current exact limits are shown in the account/AI Studio quota view.",
      "privacy_summary": "Free-tier data use depends on Google service/data terms and region.",
      "region_notes": "Availability and data terms vary by region; check Google's available-regions and terms pages.",
      "notable_models": [
        {
          "id": "gemini-2.5-flash",
          "modalities": [
            "text",
            "image",
            "audio",
            "video"
          ]
        },
        {
          "id": "gemini-2.5-flash-lite",
          "modalities": [
            "text",
            "image",
            "audio",
            "video"
          ]
        },
        {
          "id": "gemini-2.5-pro",
          "modalities": [
            "text",
            "image",
            "audio",
            "video"
          ]
        },
        {
          "id": "gemma-4-31b-it",
          "modalities": [
            "text"
          ]
        }
      ],
      "last_verified": "2026-09-20",
      "verification": "official_docs",
      "sources": [
        "https://ai.google.dev/gemini-api/docs/api-key",
        "https://ai.google.dev/gemini-api/docs/billing",
        "https://ai.google.dev/gemini-api/docs/get-started"
      ],
      "status": "active"
    },
    {
      "id": "groq",
      "name": "Groq",
      "category": "inference_provider",
      "country": "US",
      "country_flag": "🇺🇸",
      "signup_url": "https://console.groq.com/keys",
      "docs_url": "https://console.groq.com/docs/quickstart",
      "pricing_url": "https://console.groq.com/docs/billing-faqs",
      "base_url": "https://api.groq.com/openai/v1",
      "auth": "api_key",
      "account_required": true,
      "card_required": false,
      "identity_verification": "unknown",
      "openai_compatible": true,
      "free_tier_type": "recurring_free_tier",
      "free_summary": "Groq exposes a Free tier with model-specific request/token limits; payment information is needed only when upgrading to paid usage.",
      "quota_summary": "Limits are model and organization specific; the public rate-limit page lists current model ceilings and response headers expose remaining quota.",
      "privacy_summary": "Check Groq's current privacy and data-use terms before sending sensitive prompts.",
      "region_notes": "Service availability may vary by jurisdiction.",
      "notable_models": [
        {
          "id": "openai/gpt-oss-120b",
          "modalities": [
            "text"
          ],
          "rate_limit": "30 RPM, 1,000 RPD; 8K TPM on the published table"
        },
        {
          "id": "openai/gpt-oss-20b",
          "modalities": [
            "text"
          ],
          "rate_limit": "30 RPM, 1,000 RPD; 8K TPM on the published table"
        },
        {
          "id": "groq/compound",
          "modalities": [
            "text"
          ],
          "rate_limit": "30 RPM, 250 RPD on the published table"
        },
        {
          "id": "whisper-large-v3",
          "modalities": [
            "audio"
          ],
          "rate_limit": "20 RPM, 2,000 RPD on the published table"
        }
      ],
      "last_verified": "2026-09-20",
      "verification": "official_docs",
      "sources": [
        "https://console.groq.com/docs/billing-faqs",
        "https://console.groq.com/docs/rate-limits",
        "https://console.groq.com/docs/quickstart"
      ],
      "status": "active"
    },
    {
      "id": "cerebras",
      "name": "Cerebras Inference",
      "category": "first_party",
      "country": "US",
      "country_flag": "🇺🇸",
      "signup_url": "https://cloud.cerebras.ai/",
      "docs_url": "https://inference-docs.cerebras.ai/quickstart",
      "pricing_url": "https://inference-docs.cerebras.ai/support/pricing",
      "base_url": "https://api.cerebras.ai/v1",
      "auth": "api_key",
      "account_required": true,
      "card_required": null,
      "identity_verification": "unknown",
      "openai_compatible": true,
      "free_tier_type": "recurring_free_tier",
      "free_summary": "Cerebras offers a $0 Free tier with lower rate limits and community support.",
      "quota_summary": "Exact free-tier limits are account/service dependent; the provider publishes that the Free tier has lower rate limits.",
      "privacy_summary": "Review Cerebras terms before production use.",
      "region_notes": "Availability may vary.",
      "notable_models": [
        {
          "id": "gpt-oss-120b",
          "modalities": [
            "text"
          ]
        },
        {
          "id": "llama-4-scout-17b-16e-instruct",
          "modalities": [
            "text",
            "image"
          ]
        },
        {
          "id": "llama3.1-8b",
          "modalities": [
            "text"
          ]
        }
      ],
      "last_verified": "2026-09-20",
      "verification": "official_docs",
      "sources": [
        "https://inference-docs.cerebras.ai/support/pricing",
        "https://inference-docs.cerebras.ai/quickstart"
      ],
      "status": "active"
    },
    {
      "id": "mistral",
      "name": "Mistral AI",
      "category": "first_party",
      "country": "FR",
      "country_flag": "🇫🇷",
      "signup_url": "https://console.mistral.ai/api-keys",
      "docs_url": "https://docs.mistral.ai/getting-started/quickstarts/developer/first-api-request",
      "pricing_url": "https://mistral.ai/pricing",
      "base_url": "https://api.mistral.ai/v1",
      "auth": "api_key",
      "account_required": true,
      "card_required": false,
      "identity_verification": "unknown",
      "openai_compatible": true,
      "free_tier_type": "recurring_free_tier",
      "free_summary": "Mistral Studio starts in Free mode by default, with API access and limited included usage; no credit card is required to activate Studio.",
      "quota_summary": "Monthly included usage and limits are shown in the account Limits/Subscription views.",
      "privacy_summary": "Free-mode inputs and outputs may be subject to Mistral's data-use terms; review current controls before sensitive use.",
      "region_notes": "Global plan details and availability may vary.",
      "notable_models": [
        {
          "id": "mistral-small-latest",
          "modalities": [
            "text"
          ]
        },
        {
          "id": "mistral-large-latest",
          "modalities": [
            "text"
          ]
        },
        {
          "id": "codestral-latest",
          "modalities": [
            "text",
            "code"
          ]
        },
        {
          "id": "ministral-3-14b-latest",
          "modalities": [
            "text",
            "image"
          ]
        }
      ],
      "last_verified": "2026-09-20",
      "verification": "official_docs",
      "sources": [
        "https://docs.mistral.ai/getting-started/quickstarts/studio/activate-and-generate-api-key",
        "https://docs.mistral.ai/getting-started/quickstarts/developer/first-api-request",
        "https://docs.mistral.ai/admin/billing-usage/usage-limits"
      ],
      "status": "active"
    },
    {
      "id": "cohere",
      "name": "Cohere",
      "category": "first_party",
      "country": "CA",
      "country_flag": "🇨🇦",
      "signup_url": "https://dashboard.cohere.com/api-keys",
      "docs_url": "https://docs.cohere.com/docs/cohere-faqs",
      "pricing_url": "https://docs.cohere.com/docs/how-does-cohere-pricing-work",
      "base_url": "https://api.cohere.com/v2",
      "auth": "api_key",
      "account_required": true,
      "card_required": null,
      "identity_verification": "unknown",
      "openai_compatible": false,
      "free_tier_type": "free_trial_key",
      "free_summary": "A Cohere account automatically receives a trial API key. Trial API usage is free but limited.",
      "quota_summary": "The documented monthly trial limit is 1,000 calls; endpoint-specific limits also apply.",
      "privacy_summary": "Trial access is intended for testing/prototyping; check current terms for commercial and production use.",
      "region_notes": "Availability may vary.",
      "notable_models": [
        {
          "id": "command-a-03-2025",
          "modalities": [
            "text"
          ]
        },
        {
          "id": "command-a-vision-07-2025",
          "modalities": [
            "text",
            "image"
          ]
        },